{
  "dataset_version": 1,
  "title_id": "l5_archive_aztec_challenge_c64_sideB_cap01",
  "side": "B",
  "track_range": "0-0",
  "capture": {
    "hardware": "KryoFlux (archive raw import)",
    "sample_rate_hz": 25000000,
    "timestamp_utc": "2026-09-18T15:59:00Z",
    "operator": "opencode_ingest",
    "notes": "Imported from Archive.org aztec-challenge-c64 Track00.1.raw; provisional cap01 pending same-media Greaseweazle cap02."
  },
  "drive": {
    "model": "1541-family",
    "revision": "unknown"
  },
  "mechanical": {
    "rpm_mean": 300,
    "rpm_stddev": 1,
    "ambient_celsius": 24,
    "warmup_minutes": 0
  },
  "source_integrity": {
    "sha256_flux": "3cee20e4fe642f9d034002dd0c605e0f7df1ddb9b4b992f52946928c557dfe09",
    "file_size_bytes": 205544
  },
  "license": {
    "rights_note": "For preservation/research validation only; verify rights before redistribution."
  }
}
