{
  "dataset_version": 1,
  "title_id": "l5_seed_copyii_pc_v1_sideB",
  "side": "B",
  "track_range": "1-35",
  "capture": {
    "hardware": "KryoFlux",
    "sample_rate_hz": 25000000,
    "timestamp_utc": "2026-09-17T11:02:00Z",
    "operator": "seed_operator"
  },
  "drive": {
    "model": "1541C",
    "revision": "seed-rev"
  },
  "mechanical": {
    "rpm_mean": 300.0,
    "rpm_stddev": 1.1,
    "ambient_celsius": 24.0,
    "warmup_minutes": 20
  },
  "source_integrity": {
    "sha256_flux": "bbbbbbbbbbbbbbbbbbbbbbbbbbbbbbbbbbbbbbbbbbbbbbbbbbbbbbbbbbbbbbbb",
    "file_size_bytes": 1
  },
  "license": {
    "rights_note": "Seed placeholder capture for onboarding."
  }
}
