{
  "dataset_version": 1,
  "title_id": "l5_archive_kane_human_race_sideA_cap01",
  "side": "A",
  "track_range": "0-0",
  "capture": {
    "hardware": "KryoFlux (archive raw import)",
    "sample_rate_hz": 25000000,
    "timestamp_utc": "2026-09-18T15:52:00Z",
    "operator": "opencode_ingest",
    "notes": "Imported from Archive.org kane-human-race Track00.0.raw; provisional cap01 pending same-media Greaseweazle cap02."
  },
  "drive": {
    "model": "1541-family",
    "revision": "unknown"
  },
  "mechanical": {
    "rpm_mean": 300,
    "rpm_stddev": 1,
    "ambient_celsius": 24,
    "warmup_minutes": 0
  },
  "source_integrity": {
    "sha256_flux": "7b0fbf680147a361504b5113bf7a42978437a81c1c9cf909fbf1f0b5596099da",
    "file_size_bytes": 173666
  },
  "license": {
    "rights_note": "For preservation/research validation only; verify rights before redistribution."
  }
}
